{
  "event_name": "ISMB 2025",
  "help": "Enter the raffle for ISMB 2025 conference (default event). Requires only your email address to participate.",
  "destination_url": "https://docs.google.com/forms/u/0/d/e/1FAIpQLSfxGK6FZHhNgOPU4r-KANJIBgVA4S5tNw9hAvNdbEpmco3MPg/formResponse", 
  "form_fields": {
    "email": "entry.1829806584",
    "run_name": "entry.55593741",
    "hostname": "entry.1298715334",
    "platform_enabled": "entry.2075010812",
    "user_name": "",
    "workspace_id": "",
    "platform_workflow_id": ""
  }
}