{
  "event_name": "BioTechX Basel 2026",
  "help": "Enter the raffle for BioTechX Basel 2026. Requires your first name, last name, email, and organization to participate.",
  "destination_url": "https://docs.google.com/forms/u/0/d/e/1FAIpQLSdi7DfBPw8hcAxeppVIkIHKPA7W2vVH12_PjIH09viQr-m_3g/formResponse",
  "required_fields": [
    "first_name",
    "last_name",
    "affiliation"
  ],
  "form_fields": {
    "first_name": "entry.462741331",
    "last_name": "entry.57900696",
    "email": "entry.1482654313",
    "affiliation": "entry.620353698",
    "run_name": "entry.962477295",
    "uuid": "entry.376766066",
    "platform_enabled": "entry.2107699306"
  }
}
