{
  "event_name": "FOG 2025",
  "help": "Enter the raffle for FOG 2025 conference. Requires only your email address to participate.",
  "destination_url": "https://docs.google.com/forms/u/0/d/e/1FAIpQLSc1PcLUDGiyH8qI08kqMvy4ZWE2XEHxaKzfC-AZOnhczoJ1FA/formResponse",
  "form_fields": {
    "email": "entry.1829806584",
    "run_name": "entry.55593741",
    "hostname": "entry.1298715334",
    "platform_enabled": "entry.2075010812",
    "user_name": "",
    "workspace_id": "",
    "platform_workflow_id": ""
  }
}